"category","answerable","builtStatus","expectedTool","question","note"
"forecast-drivers","gap","stub","getExpenseForecast","How much are we budgeting for IT and software next quarter?","IT-group expense driver not built"
"forecast-drivers","gap","stub","getExpenseForecast","What's the T&E assumption per head in the forecast?","T&E group driver not exposed"
"forecast-drivers","gap","stub","getExpenseForecast","What are we assuming for the Anthropic and AWS bills going forward?","forward vendor-level spend driver not built; only historical txns exist"
"forecast-drivers","gap","stub","getExpenseForecast","What's the Google Ads / paid-marketing assumption in the S&M forecast?","S&M sub-line driver assumption not exposed"
"forecast-drivers","gap","stub","getExpenseForecast","How is employee-expense burden (taxes, medical, benefits) forecast?","Employee Expenses burden driver not wired"
"forecast-drivers","gap","stub","getExpenseForecast","What facilities / lease cost are we carrying in the forecast?","Facilities-group expense driver not built"
"forecast-drivers","gap","stub","getArForecast","What DSO assumption is driving the AR forecast?","need AR Forecast driver tool exposing DSO"
"forecast-drivers","gap","stub","getArForecast","How are receivables expected to trend over the next six months?","AR driver projection not wired; balance sheet shows balances not the assumption"
"forecast-drivers","gap","stub","getArForecast","If DSO improved by 10 days, how would that change the forecast?","DSO lever sensitivity is an AR-driver + Scenario capability, neither wired"
"forecast-drivers","gap","stub","getFixedAssetForecast","What capex are we planning for the rest of FY26?","need Fixed Asset Budget driver tool"
"forecast-drivers","gap","stub","getFixedAssetForecast","Show me the depreciation schedule baked into the forecast.","depreciation-schedule driver not wired; D&A appears on P&L but not the schedule"
"forecast-drivers","gap","stub","getPrepaidsForecast","What's the prepaid amortization assumption in the plan?","need Prepaids Budget driver tool"
"forecast-drivers","gap","stub","getPrepaidsForecast","How much prepaid expense are we amortizing each month through year end?","Prepaids amortization driver not built"
"forecast-drivers","gap","stub","getApForecast","What DPO / payables-timing assumption are we using for cash?","AP/DPO driver exists in seed but no Scout tool and the driver surface is unbuilt"
"forecast-drivers","gap","stub","getRevenueForecast","What new-logo count are we assuming per quarter in the revenue plan?","new-logo driver assumption not exposed"
"forecast-drivers","gap","stub","getRevenueForecast","What retention/churn assumption is built into the subscription forecast?","retention driver assumption not wired; cohort NRR metric is backward-looking"
"forecast-drivers","gap","stub","getRevenueForecast","What utilization rate are we assuming for the services forecast?","forward utilization assumption not built; utilization metric is actuals-based"
"forecast-drivers","gap","stub","getRevenueForecast","What's the assumed price increase in the forecast and when does it hit?","pricing-uplift driver assumption not exposed"
"forecast-drivers","gap","stub","getRevenueForecast","How does the forecast assume implementation capacity gates SaaS go-lives?","capacity-gating driver logic not surfaced; guide may partly explain"
"forecast-drivers","ambiguous","wired","getMetric","What gross margin does the forecast assume by Q4?","getMetric gross_margin_pct returns the output; user may actually want the CoR-rate driver (unbuilt)"
"forecast-drivers","now","wired","getMonthlyPnL","What's the forecast revenue for December?","Dec 2026 is a forecast month; getMonthlyPnL returns the forecast revenue output"
"forecast-drivers","ambiguous","wired","getMonthlyPnL","What's our projected operating expense total for Q4?","getMonthlyPnL gives the OpEx output total; user may want the per-group Expense Forecast driver breakdown (unbuilt)"
"forecast-drivers","now","wired","getMetric","What runway does the forecast give us?","runway metric is wired; could also route to getCashFlow/getDashboard"
"forecast-drivers","ambiguous","wired","getMetric","Where does the forecast put ARR by the end of the year?","getMetric arr_mrr returns run-rate; the new-business driver behind it is unbuilt; could mis-route to getCustomers"
"forecast-drivers","now","wired","getPnL","What net income does the plan forecast for full-year FY26?","FY26 net income is a wired P&L output; the drivers behind it are not inspectable"
"forecast-drivers","ambiguous","wired","explainVariance","Show me the forecast vs budget for personnel cost in Q3.","explainVariance/getPnL can show the line variance; the underlying hiring-plan driver detail is unbuilt"
"forecast-drivers","gap","stub","getPersonnelForecast","What headcount does the plan end the year at?","no getHeadcount/Personnel driver tool; ~140 is in narrative not a queryable forecast"
"forecast-drivers","gap","stub","getRevenueForecast","What's the assumed sales rep ramp / quota attainment in the bookings plan?","rep-ramp driver assumption not built; Pipeline tool also absent"
"forecast-drivers","gap","stub","getExpenseForecast","How much marketing spend per dollar of new ARR are we planning (forecast magic number)?","forward magic-number needs S&M + revenue drivers; magic_number metric is backward-looking"
"forecast-drivers","gap","stub","getCashFlow","What interest income/expense are we assuming on the cash balance?","interest assumption is a driver detail with no dedicated tool"
"forecast-drivers","gap","stub","getRevenueForecast","What FX assumption is in the forecast?","no FX driver surface; single-currency seed, assumption not exposed"
"forecast-drivers","gap","stub","getPnL","What's the assumed tax rate / provision in the forecast?","tax-provision driver assumption not exposed; only the output line exists"
"forecast-drivers","gap","none","setDriver","Can you change our Q3 hiring plan to add 5 more engineers and reforecast?","driver write path / Scenario setDriver not built; Scout is read-only over the spine"
"forecast-drivers","gap","none","setDriver","Bump the S&M opex assumption 15% and show me the new operating income.","this is a Scenario lever + engine, both unbuilt; no write tool wired"
"forecast-drivers","gap","none","lockBudget","Lock the current forecast as our budget.","lockBudget write tool not built"
"forecast-drivers","decline","na","decline","How should we depreciate the new laptops we're buying for capex purposes?","out of scope: tax/accounting-policy advice; Dogfood reads a clean close, doesn't set policy"
"forecast-drivers","decline","na","decline","Post the depreciation journal entry for the forecast capex.","out of scope: posting JEs is the ERP's job; Dogfood reads a clean close"
"forecast-drivers","decline","na","decline","What revenue growth are comparable AI-native FP&A startups assuming this year?","out of scope: external/non-Bearing market data not in the spine"
"forecast-drivers","decline","na","decline","What does the revenue forecast look like for FY28?","out of scope: seed horizon ends Dec 2026; FY28 not in data"
"forecast-drivers","ambiguous","wired","getBalanceSheet","What prepaid balance does the forecast carry on the balance sheet at year end?","getBalanceSheet returns the forecast prepaid balance; user may want the Prepaids amortization driver (unbuilt)"
"forecast-drivers","gap","stub","getCashFlow","What assumptions sit behind the cash flow forecast for next quarter?","getCashFlow shows the output; the driver assumptions behind it have no tools"
"scenarios-budget","now","na","product-knowledge","What is a scenario in Dogfood?","Creating-scenarios guide covers this"
"scenarios-budget","now","na","product-knowledge","How do I create a new scenario?","How-to lives in the guide"
"scenarios-budget","now","na","product-knowledge","What's the difference between Base and Budget?","Budgets-and-forecasts guide"
"scenarios-budget","now","na","product-knowledge","How is the Budget different from a scenario?","guide explains both"
"scenarios-budget","now","na","product-knowledge","What levers can I adjust in a scenario?","lever set documented in guide"
"scenarios-budget","now","na","product-knowledge","Can I model a hiring freeze?","guide describes Personnel freeze lever; engine not built"
"scenarios-budget","now","na","product-knowledge","What's the difference between a step and a ramp adjustment?","adjustment shape in guide"
"scenarios-budget","now","na","product-knowledge","Do my scenarios change the Dashboard everyone sees?","containment principle in guide"
"scenarios-budget","now","na","product-knowledge","How do I lock the budget?","lock lifecycle described; the action itself is a gap"
"scenarios-budget","now","na","product-knowledge","What happens to Base after I lock the Budget?","guide explains the divergence"
"scenarios-budget","now","na","product-knowledge","Can I duplicate an existing scenario?","Scenario Manager duplicate is documented"
"scenarios-budget","now","na","product-knowledge","What are the seed preset scenarios?","presets listed in guide"
"scenarios-budget","now","na","product-knowledge","How granular can my scenario time windows be?","monthly window in guide"
"scenarios-budget","now","na","product-knowledge","Why can't I drill a scenario number to a transaction?","trade documented in guide"
"scenarios-budget","now","na","product-knowledge","Can each scenario compare against either Base or Budget?","Scenario P&L baseline dropdown in guide"
"scenarios-budget","now","wired","getPnL","What's the budgeted revenue for FY26?","P&L carries the Budget column"
"scenarios-budget","now","wired","explainVariance","Show me budget vs actual for May.","variance is on the statements"
"scenarios-budget","gap","stub","setDriver","Build me a scenario where we freeze hiring through year end.","scenario engine + setDriver not wired"
"scenarios-budget","gap","stub","setDriver","Spin up a downside case with revenue growth cut to 20%.","engine stub; growth lever not wired"
"scenarios-budget","gap","stub","setDriver","What if we hired 10 more engineers starting in Q3?","engine not built"
"scenarios-budget","gap","stub","compareScenarios","Compare my Breakeven scenario against Base.","compareScenarios not wired"
"scenarios-budget","gap","stub","compareScenarios","Show me the three presets side by side.","compare surface not built"
"scenarios-budget","gap","stub","lockBudget","Lock the current forecast as our FY26 Budget.","lockBudget not wired"
"scenarios-budget","gap","stub","setDriver","Reset the Capacity scenario back to Base.","Scenario Manager reset not built"
"scenarios-budget","gap","stub","setDriver","What would runway look like if we cut S&M spend 30%?","engine not built; can't model the cut"
"scenarios-budget","gap","stub","setDriver","Model a 25% price increase on subscriptions next quarter.","engine not built"
"scenarios-budget","gap","stub","compareScenarios","What's the EBIT in my 25% Profit scenario?","Scenario P&L not built"
"scenarios-budget","gap","stub","setDriver","How does net income change if we push DSO out to 75 days?","engine not built"
"scenarios-budget","gap","stub","setDriver","Create a scenario that ramps the sales team from July to December.","engine not built"
"scenarios-budget","gap","stub","setDriver","What if we delay the Series B by six months?","engine not built; financing not a defined lever"
"scenarios-budget","now","wired","getPnL","Show variance of Base vs Budget for operating income in FY26.","P&L Budget vs Forecast columns"
"scenarios-budget","now","wired","getMonthlyPnL","Which months are we over budget on payroll?","monthly P&L exposes budget vs actual by month"
"scenarios-budget","now","wired","getPnL","What's our budgeted gross margin for the year?","GM% on the P&L Budget column"
"scenarios-budget","now","wired","explainVariance","How far off budget is marketing spend so far this year?","variance read on statements"
"scenarios-budget","gap","stub","setDriver","Set up a scenario that cuts opex 15% across the board.","engine not built"
"scenarios-budget","gap","stub","compareScenarios","What's our breakeven scenario assume about headcount?","Scenario Drivers board not built"
"scenarios-budget","gap","stub","compareScenarios","Compare this quarter's plan to last quarter's plan.","no historical plan snapshots beyond a single Budget lock"
"scenarios-budget","gap","stub","setDriver","If we slow hiring, how much runway do we extend?","engine not built"
"scenarios-budget","gap","stub","compareScenarios","Year over year, how does my growth-ramp scenario compare to actual FY25?","engine not built"
"scenarios-budget","now","na","product-knowledge","Can I edit a preset scenario's levers?","guide: presets are editable bundles"
"scenarios-budget","gap","stub","setDriver","What two adjustments would get us to 25% profit?","engine + any goal-seek not built"
"scenarios-budget","gap","stub","compareScenarios","Make a best-case and worst-case and show them next to Base.","engine not built"
"scenarios-budget","gap","stub","setDriver","What happens to cash if collections slip — push DSO to 90 in Q4?","engine not built"
"scenarios-budget","gap","stub","setDriver","Model stretching vendor payments to 60-day DPO.","engine not built"
"scenarios-budget","gap","stub","setDriver","Update my growth-ramp scenario to start in August instead of July.","engine not built"
"scenarios-budget","gap","stub","setDriver","Delete my old downside scenario.","Scenario Manager CRUD not built"
"scenarios-budget","gap","stub","compareScenarios","What's the magic number in my Capacity scenario?","scenario engine + scenario metrics not built"
"scenarios-budget","now","na","product-knowledge","Two of my adjustments hit the same lever — which one wins?","composition rule is in the scenario contract/guide"
"scenarios-budget","now","na","product-knowledge","Why did my scenario get rejected when I set growth to 500%?","validation rules documented; engine itself not built"
"scenarios-budget","gap","stub","compareScenarios","Show the dashboard for my Breakeven scenario.","Scenario Dashboard not built"
"scenarios-budget","now","wired","getPnL","What's the budget for the Engineering department this year?","indirect payroll on P&L Budget column; dept-level may need driver surface"
"scenarios-budget","now","wired","explainVariance","How much have we burned vs what we budgeted to burn?","net burn vs budget via statement variance"
"scenarios-budget","decline","na","decline","Run the June close so I can lock the budget off final actuals.","running the close is the ERP's job; out of scope"
"scenarios-budget","decline","na","decline","In my hiring-freeze scenario, how much equity dilution do we avoid?","cap table is out of scope (Carta's job)"
"scenarios-budget","decline","na","decline","Should I lock the budget now for tax-planning reasons?","tax advice out of scope"
"scenarios-budget","ambiguous","stub","setDriver","Build a scenario and tell me runway.","if read as plain runway it hits getMetric/getCashFlow; the create-scenario half is a gap"
"scenarios-budget","ambiguous","wired","getMetric","What's our runway under budget?","runway could route to getMetric vs getCashFlow vs getDashboard; 'under budget' has no scenario surface"
"scenarios-budget","ambiguous","wired","getPnL","Show me the forecast vs the plan.","'plan'=Budget -> getPnL columns, but could be misread as a scenario compare (gap)"
"scenarios-budget","ambiguous","stub","compareScenarios","What's the variance on my scenario?","'variance' may route to explainVariance (wired) but the scenario context is a gap"
"scenarios-budget","gap","na","product-knowledge","How do I share a scenario with the board?","Board Package / scenario export not built"
"scenarios-budget","gap","stub","setDriver","Can Scout build a scenario for me automatically?","setDriver tool not wired"
"scenarios-budget","gap","stub","compareScenarios","What's the assumption set behind the 25% Profit preset's S&M lever?","Scenario Drivers board not built"
"scenarios-budget","gap","stub","lockBudget","Roll my Base forecast forward and re-lock the budget.","lockBudget + as-of roll-forward not wired"
"scenarios-budget","gap","stub","setDriver","If we ramp marketing in H2, what does ARR look like at year end?","engine not built"
"scenarios-budget","gap","stub","setDriver","Give me a scenario where services revenue grows but subscription stays flat.","engine not built"
"flux-notes","now","wired","product-knowledge","How do I run a flux analysis in Dogfood?","Guide creating-a-flux-analysis covers the how-to"
"flux-notes","now","wired","product-knowledge","Walk me through doing a monthly flux review.","Served from User Guides product-knowledge lane"
"flux-notes","now","wired","product-knowledge","What's a flux note and where do they get saved?","Guide explains flux_notes keyed on stable txn id"
"flux-notes","now","wired","product-knowledge","Where do I add commentary explaining a variance?","How-to is product-knowledge; the write UI itself is unbuilt"
"flux-notes","now","wired","explainVariance","Why did Travel & Entertainment jump in May vs April?","Statement-line MoM variance is wired"
"flux-notes","now","wired","explainVariance","Explain the big swing in Sales & Marketing this quarter.","explainVariance handles statement-line variance"
"flux-notes","now","wired","explainVariance","What drove the gross margin variance in Q1?","Variance narrative wired via explainVariance/getMetric"
"flux-notes","now","wired","explainVariance","Why is IT spend over budget?","Budget/actual variance columns feed explainVariance"
"flux-notes","now","wired","explainVariance","Explain the revenue variance to budget for FY26.","Variance to budget is wired"
"flux-notes","now","wired","explainVariance","Why did operating income come in below plan in May?","explainVariance covers statement subtotals"
"flux-notes","now","wired","explainVariance","Break down the Facilities variance vs last quarter.","QoQ variance narrative wired"
"flux-notes","now","wired","explainVariance","What's behind the personnel cost increase month over month?","Indirect/direct payroll line variance is wired"
"flux-notes","now","wired","explainVariance","Explain the net income swing year over year.","YoY variance narrative wired"
"flux-notes","now","wired","product-knowledge","What's the process for flagging an unexplained variance for review?","How-to from guide; the flag store is unbuilt"
"flux-notes","gap","none","addFluxNote","Add a note on the AWS bill explaining the May spike was a one-time reserved-instance purchase.","addFluxNote designed-not-built; needs Supabase write path"
"flux-notes","gap","none","addFluxNote","Leave a flux comment on the Datadog transaction.","addFluxNote not built"
"flux-notes","gap","none","addFluxNote","Note that the T&E overage was the sales offsite, on that line.","Per-line note write path unbuilt"
"flux-notes","gap","none","addFluxNote","Save my explanation for the marketing variance so the board sees it.","flux_notes write store not built"
"flux-notes","gap","none","addFluxNote","Record a reviewer note on the Anthropic invoice for $48k.","addFluxNote keyed on stable txn id, unbuilt"
"flux-notes","gap","none","addFluxNote","Tag the Ramp expense as reviewed and explained.","Review-status write path not built"
"flux-notes","gap","none","getFluxNotes","What notes have we already written on the Facilities account?","getFluxNotes designed-not-built"
"flux-notes","gap","none","getFluxNotes","Show me all the flux notes for May.","getFluxNotes not built"
"flux-notes","gap","none","getFluxNotes","Did anyone explain the IT spike yet?","Note-read path unbuilt"
"flux-notes","gap","none","getFluxNotes","Pull the commentary on the Q3 S&M variance.","getFluxNotes not built"
"flux-notes","gap","none","getFluxNotes","What did I write on the Google Ads bill last month?","Per-txn note read unbuilt"
"flux-notes","gap","none","getFluxNotes","Which variances are still unexplained this month?","Unexplained/outstanding-flux surface not built"
"flux-notes","gap","none","getFluxNotes","What's left to explain before we close the flux review?","Outstanding-items worklist not built"
"flux-notes","gap","none","getFluxNotes","Show me every account over budget that doesn't have a note yet.","Combines variance + note-status; note status unbuilt"
"flux-notes","gap","none","getFluxDetail","How much of the expense variance is still uncategorized?","Uncategorized/reconciliation surface not built"
"flux-notes","gap","none","getFluxDetail","Give me the transaction-level detail behind the May Facilities variance.","getFluxDetail designed-not-built"
"flux-notes","gap","none","getFluxDetail","Break the IT overage down to individual transactions.","getFluxDetail not built"
"flux-notes","gap","none","getFluxDetail","Which specific vendors drove the T&E spike?","Txn/vendor-level flux drill not built"
"flux-notes","gap","none","getFluxDetail","Show the line items making up the unexplained piece of the OpEx variance.","Unexplained-residual drill not built"
"flux-notes","gap","none","addFluxNote","Mark the Facilities variance as approved by me.","Sign-off/approval write path not built"
"flux-notes","gap","none","addFluxNote","Assign the unexplained marketing variance to the VP of Sales to explain.","Assignment/workflow on flux items not built"
"flux-notes","gap","none","addFluxNote","Reopen the note on the Anthropic invoice, my explanation changed.","Note edit/update path not built"
"flux-notes","gap","none","addFluxNote","Delete the flux note I left on the Ramp transaction.","Note delete path not built"
"flux-notes","gap","none","getFluxNotes","Did the flux note I wrote last month survive the re-import?","flux_notes keyed on stable id; read/persist path unbuilt"
"flux-notes","gap","none","getFluxNotes","List all transactions I've flagged but not yet explained.","Flag + note-status store not built"
"flux-notes","gap","none","getFluxNotes","What notes did Chris add to the Q2 board flux?","getFluxNotes not built; single-user demo"
"flux-notes","gap","none","getFluxNotes","Summarize all my flux commentary into the board narrative.","Reads stored notes (unbuilt) then summarizes"
"flux-notes","gap","none","addFluxNote","Explain why deferred revenue moved this month and let me note it.","explain part works; the note write is unbuilt -> overall gap"
"flux-notes","gap","none","addFluxNote","Flag the depreciation jump for the auditors with a note.","addFluxNote not built"
"flux-notes","now","wired","product-knowledge","What variance threshold triggers a required flux note here?","Threshold policy is in the flux guide"
"flux-notes","gap","none","getFluxNotes","Show me the flux notes attached to our biggest customer's revenue.","getFluxNotes not built"
"flux-notes","now","wired","product-knowledge","How do I attach a note to a specific GL account vs a single transaction?","Guide covers account-vs-txn note keying"
"flux-notes","gap","none","addFluxNote","Add a note to the Q3 P&L explaining the services revenue miss was a slipped go-live.","addFluxNote not built"
"flux-notes","gap","none","addFluxNote","Why did HR expense spike and can you log the reason for me?","explain wired; logging the note is the gap"
"flux-notes","gap","none","getFluxDetail","Categorize the uncategorized expense bucket for May.","Uncategorized resolution/write surface not built"
"flux-notes","decline","na","decline","Should I capitalize the IT variance for tax purposes?","Tax advice is out of scope"
"flux-notes","decline","na","decline","Post a journal entry to reclass the misbooked Facilities expense.","Posting JEs / the close is the ERP's job"
"flux-notes","decline","na","decline","How does our expense-variance explanation rate compare to other Series B SaaS companies?","Non-Bearing external-market data out of scope"
"flux-notes","gap","none","addFluxNote","Note on the deferred revenue line that the swing is timing, not churn.","addFluxNote not built; could also be misread as getBalanceSheet"
"flux-notes","ambiguous","none","addFluxNote","Explain the runway change and save a one-liner for the board.","explain via getMetric/getCashFlow works; the note write is the unbuilt part -> risks answering without saving"
"flux-notes","ambiguous","none","getFluxNotes","Why is AR up — and is there already a note on it?","explainVariance can answer 'why'; the note-lookup half hits unbuilt getFluxNotes"
"period-import-actuals","now","wired","product-knowledge","How does closing a period work in Dogfood?","Updating-actuals guide covers the global as-of and new-month flow"
"period-import-actuals","now","wired","product-knowledge","What's our current as-of date?","Close boundary is May 2026 Actual / June in close; guide+dashboard convey it"
"period-import-actuals","now","wired","product-knowledge","Which months are closed actuals versus forecast right now?","Jan24-May26 closed, June in close, Jul-Dec26 forecast"
"period-import-actuals","now","wired","product-knowledge","Explain the difference between an actual month and a forecast month in the statements.","Reading-the-statements / updating-actuals guide"
"period-import-actuals","now","wired","product-knowledge","What is the as-of date and why does it matter?","Guide explains one global as-of drives the split everywhere"
"period-import-actuals","now","wired","product-knowledge","Walk me through importing a new month of actuals.","New-month flow is documented in the import-templates README / guide"
"period-import-actuals","now","wired","product-knowledge","How do you handle a restatement of a prior period?","Guide: re-import + roll forward without moving the as-of"
"period-import-actuals","now","wired","product-knowledge","How does Dogfood reconcile transaction detail to the trial balance?","Guide: sub-ledger reconciles UP to TB, gaps flag as uncategorized"
