"category","answerable","builtStatus","expectedTool","question","note"
"balance-sheet-cashflow","now","wired","getCashFlow","What's the working capital change in our cash flow?","Δ AR/AP/deferred in OCF"
"balance-sheet-cashflow","now","wired","getCashFlow","How much did the change in AR affect cash this quarter?","change_ar in OCF"
"balance-sheet-cashflow","now","wired","getCashFlow","How did the change in AP move cash this year?","change_ap in OCF"
"balance-sheet-cashflow","now","wired","getCashFlow","How much of our cash flow is the deferred revenue build?","Δ deferred in OCF (annual-prepay cash engine)"
"balance-sheet-cashflow","now","wired","getCashFlow","Is SBC added back in operating cash flow?","SBC add-back in OCF"
"balance-sheet-cashflow","now","wired","getCashFlow","How much depreciation gets added back in the cash flow?","D&A add-back in OCF"
"balance-sheet-cashflow","ambiguous","wired","getMetric","What's our net burn right now?","may route to getCashFlow or getDashboard instead of getMetric net_burn"
"balance-sheet-cashflow","ambiguous","wired","getMetric","How many months of runway do we have?","runway also on getCashFlow getRunway and getDashboard tile"
"balance-sheet-cashflow","now","wired","getMetric","What's our runway?","runway metric ~49mo"
"balance-sheet-cashflow","now","wired","getMetric","What's our burn multiple?","burn_multiple ~0.6x"
"balance-sheet-cashflow","now","wired","getCashFlow","How did our cash position change from Q1 to Q2?","Net change in cash across periods"
"balance-sheet-cashflow","now","wired","getCashFlow","Why did cash drop this month?","Walk OCF/investing/financing for the month"
"balance-sheet-cashflow","gap","none","addFluxNote","Add a flux note explaining the AR spike this month.","flux-notes write path designed not built"
"balance-sheet-cashflow","gap","none","getFluxNotes","What flux notes are on the deferred revenue movement?","getFluxNotes designed not built"
"balance-sheet-cashflow","gap","none","getFluxDetail","Reconcile our AR subledger detail to the trial balance.","reconciliation/flux detail surface not built"
"balance-sheet-cashflow","gap","none","lockBudget","Lock the current balance sheet forecast as our budget.","lockBudget tool not wired"
"balance-sheet-cashflow","decline","na","decline","Post a journal entry to reclass the prepaid insurance.","posting JEs / running the close is the ERP's job, out of scope"
"balance-sheet-cashflow","decline","na","decline","Reconcile our bank statement to the GL cash account.","close/reconciliation operations out of scope; Dogfood reads a clean close"
"balance-sheet-cashflow","decline","na","decline","What will our cash balance be at the end of 2027?","beyond Dec 2026 seed horizon"
"balance-sheet-cashflow","now","wired","getBalanceSheet","How does our deferred revenue compare year over year?","Compare deferred BS line across FY24/25/26"
"balance-sheet-cashflow","now","wired","getBalanceSheet","What's our quick ratio and current ratio?","Composed from current assets/liabilities on BS"
"balance-sheet-cashflow","now","wired","getBalanceSheet","How much of our assets is cash vs receivables vs everything else?","Asset mix from BS lines"
"balance-sheet-cashflow","now","wired","getCashFlow","What drove the net change in cash for FY26?","OCF + investing + financing = net change"
"contracts-bookings","now","wired","getContracts","How many active contracts do we have right now?",""
"contracts-bookings","now","wired","getContracts","Show me the contracts register.",""
"contracts-bookings","now","wired","getContracts","What's our total ARR across all signed contracts?",""
"contracts-bookings","now","wired","getContract","Pull up the contract for our biggest customer.",""
"contracts-bookings","ambiguous","wired","getContracts","What were our new bookings in May?","single-month vs YoY may misroute to getBookingsHistory"
"contracts-bookings","now","wired","getBookingsHistory","How do bookings this quarter compare to the same quarter last year?",""
"contracts-bookings","now","wired","getBookingsHistory","What's our trailing-twelve-month bookings number?",""
"contracts-bookings","now","wired","getContracts","Break down bookings into new, expansion, and contraction for Q2.",""
"contracts-bookings","now","wired","getContracts","How much expansion ARR did we book this year?",""
"contracts-bookings","now","wired","getContracts","What was our contraction / downsell amount last quarter?",""
"contracts-bookings","now","wired","getBookingsHistory","Bookings YoY?",""
"contracts-bookings","ambiguous","wired","getContracts","What's our deferred revenue balance?","could route to getBalanceSheet liability vs getContracts waterfall"
"contracts-bookings","now","wired","getContracts","Walk me through the deferred revenue waterfall for the next six months.",""
"contracts-bookings","now","wired","getContracts","What's our RPO / backlog right now?",""
"contracts-bookings","now","wired","getContracts","How much contracted revenue is still left to recognize?",""
"contracts-bookings","now","wired","getContracts","Show me the contracted-revenue bridge from recognized-to-date to forward.",""
"contracts-bookings","gap","stub","getNrr","Which contracts are up for renewal in the next 90 days?","needs Renewals register / listRenewals tool (not wired)"
"contracts-bookings","gap","stub","getGrr","What's our renewal rate this year?","renewals register / getGrr composed-not-wired"
"contracts-bookings","now","wired","getContracts","List every contract signed in the last 30 days.",""
"contracts-bookings","now","wired","getContracts","What's the average contract value across the book?",""
"contracts-bookings","now","wired","getContracts","Show me the largest contracts by ARR.",""
"contracts-bookings","now","wired","getContracts","What was the biggest deal we booked this quarter?",""
"contracts-bookings","now","wired","getContracts","How long is the typical contract term?",""
"contracts-bookings","now","wired","getContracts","What share of contracts are subscription vs services?",""
"contracts-bookings","now","wired","getContracts","How much of our bookings this year were subscription versus services?",""
"contracts-bookings","now","wired","getBookingsHistory","Did bookings grow year over year?",""
"contracts-bookings","ambiguous","wired","getContracts","What were total bookings in FY26 so far?","FY total vs TTM could split getContracts/getBookingsHistory"
"contracts-bookings","now","wired","getContract","Pull the contract details for Helix AI.",""
"contracts-bookings","now","wired","getContract","When does the Northwind Cloud contract renew?",""
"contracts-bookings","now","wired","getContract","What's the deferred balance attributable to our top account?",""
"contracts-bookings","now","wired","getBookingsHistory","How lumpy were bookings month to month this year?",""
"contracts-bookings","ambiguous","wired","getContracts","Net new ARR booked last month?","single-month vs trailing could hit getBookingsHistory"
"contracts-bookings","ambiguous","wired","getContracts","Show me bookings by sales rep this quarter.","rep-level may belong to Pipeline (not wired) rather than contracts"
"contracts-bookings","now","wired","getContracts","How is our backlog trending compared to last quarter?",""
"contracts-bookings","ambiguous","wired","getBalanceSheet","What's the deferred revenue on the balance sheet?","phrasing points to getBalanceSheet vs getContracts waterfall"
"contracts-bookings","now","wired","getContracts","How much new logo ARR did we add in Q1?",""
"contracts-bookings","now","wired","getContracts","Which contracts had expansions this year?",""
"contracts-bookings","now","wired","getContracts","Which contracts contracted or downsized?",""
"contracts-bookings","now","wired","getBookingsHistory","What's our average bookings per month over the trailing year?",""
"contracts-bookings","now","wired","getBookingsHistory","How does this month's bookings stack up against the same month last year?",""
"contracts-bookings","ambiguous","wired","getMetric","What's our NRR off the contract base?","cohort NRR via getMetric vs getCustomers segment view"
"contracts-bookings","ambiguous","wired","getCustomers","How many logos did we lose this year?","churned logos (getCustomers) vs logo-retention rate (getMetric)"
"contracts-bookings","now","wired","getContracts","What revenue will recognize from existing contracts in Q4?",""
"contracts-bookings","now","wired","getContracts","Show the deferred waterfall by stream.",""
"contracts-bookings","now","wired","getContracts","What's the weighted-average remaining term on the book?",""
"contracts-bookings","now","wired","getContracts","Give me a list of contracts expiring before year-end.",""
"contracts-bookings","gap","none","getPipeline","How much of our pipeline converted to bookings this quarter?","no getPipeline tool; pipeline register not built"
"contracts-bookings","gap","none","getPipeline","What's our pipeline coverage against next quarter's bookings target?","no getPipeline / getPipelineCoverage tool"
"contracts-bookings","gap","stub","compareScenarios","If we raised new-business bookings 20%, what happens to ARR?","scenarios engine not built / not wired"
"contracts-bookings","gap","stub","addFluxNote","Add a note on the Helix AI contract that the renewal is at risk.","flux-notes write path designed not built"
"contracts-bookings","decline","na","decline","What were our commission costs on this quarter's bookings?","commission capitalization (340-40) deferred/out of scope"
"contracts-bookings","decline","na","decline","How does our bookings growth compare to Numeric's?","external/non-Bearing market data out of scope"
"contracts-bookings","decline","na","decline","What's the right revenue-recognition treatment for a multi-year ramp deal under ASC 606?","GAAP/accounting advice; Dogfood reads a clean close, doesn't rule on rec policy"
"contracts-bookings","decline","na","decline","What equity stake does our biggest customer hold in us?","cap table is Carta's job, out of scope"
"contracts-bookings","decline","na","decline","Project our bookings for 2028.","beyond Dec 2026 seed horizon"
"contracts-bookings","now","wired","getBookingsHistory","What's our bookings number for 2026 versus 2025 and 2024?",""
"contracts-bookings","now","wired","getContracts","Show me which contracts are driving most of our deferred balance.",""
"contracts-bookings","now","wired","getContracts","How much ARR is locked in for next year already?",""
"contracts-bookings","now","wired","getContracts","What's the split of bookings between new logos and the existing base?",""
"contracts-bookings","now","wired","getBookingsHistory","Was Q2 a soft bookings quarter relative to history?",""
"contracts-bookings","now","wired","getContracts","What's the total contract value of everything we've signed?",""
"contracts-bookings","now","wired","getBookingsHistory","Show me the bookings trend over the last eight quarters.",""
"contracts-bookings","now","wired","getContracts","How much services revenue is under contract right now?",""
"contracts-bookings","gap","stub","getNrr","What is the renewal value coming due in Q3?","renewals worklist not wired"
"contracts-bookings","now","wired","getContracts","What portion of our ARR comes from our top 10 contracts?",""
"contracts-bookings","now","wired","getContracts","Did any contract more than double in size this year?",""
"customers-churn","now","wired","getCustomers","Which customers churned this year?","Filter customer list to churned status"
"customers-churn","ambiguous","wired","getMetric","What's our logo churn rate?","logo_retention metric, NOT a getCustomers logo list"
"customers-churn","ambiguous","wired","getCustomers","How many logos did we lose in Q2?","churned LOGOS via getCustomers, not the rate metric"
"customers-churn","now","wired","getCustomers","Show me all our customers.","Straight customer register read"
"customers-churn","now","wired","getCustomers","Who's our biggest customer by ARR?","Sort customers by ARR descending"
"customers-churn","now","wired","getCustomer","What's the ARR for Helix AI?","Entity-specific customer lookup"
"customers-churn","now","wired","getCustomers","Give me ARR broken down by customer.","Per-customer ARR is a getCustomers field, not bare ARR metric"
"customers-churn","ambiguous","wired","getMetric","What's our ARR?","bare ARR = getMetric arr_mrr, not the getCustomers breakdown"
"customers-churn","now","wired","getCustomers","Which accounts expanded this year?","Expansion flag on customer records"
"customers-churn","now","wired","getCustomers","How much expansion ARR did we book in FY26?","Expansion ARR aggregated across customers"
"customers-churn","now","wired","getMetric","What's our net revenue retention?","Cohort NRR (i-12) via getMetric nrr"
"customers-churn","ambiguous","wired","getMetric","What's gross revenue retention?","grr via getMetric if cataloged; Renewals getGrr is composed-not-wired"
"customers-churn","now","wired","getCustomers","How many customers do we have right now?","Count active customers in register"
"customers-churn","now","wired","getCustomer","Tell me about the Northwind Cloud account.","Customer profile lookup"
"customers-churn","gap","none","getRenewals","Which customers are at risk of churning?","Needs Renewals worklist / health surface; no getRenewals tool"
"customers-churn","ambiguous","wired","getMetric","What's our churn rate vs last quarter?","logo_retention metric over periods, not churned-logo list"
"customers-churn","now","wired","getCustomers","List the customers who downgraded or contracted their spend.","Contraction flag in customer records (NRR bridge has downsells)"
"customers-churn","ambiguous","wired","getCustomers","Who churned in May?","churned LOGOS by month via getCustomers, not rate metric"
"customers-churn","now","wired","getCustomers","What was the ARR we lost to churn this year?","Churned-ARR aggregate; tile shows '—' when none"
"customers-churn","now","wired","getCustomers","Show me our top 10 customers.","Sort + limit customer list"
"customers-churn","now","wired","getCustomers","How concentrated is our revenue in the top accounts?","Compute top-N share from per-customer ARR"
"customers-churn","now","wired","getMetric","What's our NRR for the i-12 cohort?","Exact cohort NRR definition Scout uses"
"customers-churn","now","wired","getMetric","Did NRR go up or down year over year?","NRR across periods via getMetric"
"customers-churn","gap","none","getCustomers","Which segment has the worst retention?","Needs segment-level retention rollup; not in current getCustomers shape"
"customers-churn","ambiguous","wired","getCustomers","Break down ARR by customer segment.","getCustomers segment view vs getMetric bare ARR"
"customers-churn","now","wired","getCustomers","How many new logos did we add this year?","New customers in FY26 from register"
"customers-churn","now","wired","getMetric","What's the lifetime value of our average customer?","ltv_cac metric basis"
"customers-churn","gap","none","getRenewals","Show me the customer health scores.","No health-score data modeled; needs Renewals/health surface"
"customers-churn","now","wired","getCustomers","Who are our newest customers?","Sort customers by start date"
"customers-churn","ambiguous","wired","getMetric","What percentage of customers renewed?","logo_retention metric vs Renewals register (getRenewals not wired)"
"customers-churn","gap","none","getRenewals","What's our renewal pipeline for the next quarter?","Renewals register not wired as a Scout tool"
"customers-churn","gap","none","getRenewals","How much of Helix AI's contract is up for renewal soon?","Per-customer renewal schedule needs Renewals; getContract has terms but not renewal worklist"
"customers-churn","now","wired","getCustomers","What's the average ARR per customer?","Total ARR / customer count from register"
"customers-churn","now","wired","getCustomers","Which customers haven't expanded at all?","Filter customers with zero expansion"
"customers-churn","now","wired","getCustomers","Show me the churn for FY26 in dollars and logos.","Both churn measures from customer register"
"customers-churn","ambiguous","wired","getMetric","What's driving the dip in NRR?","getMetric nrr basis vs a customer-level expansion/contraction bridge in getCustomers"
"customers-churn","now","wired","getCustomers","Compare expansion vs contraction this year.","Both flags aggregated from customer records"
"customers-churn","gap","none","getCustomers","Which rep owns our biggest churned account?","Customer-to-rep ownership not in getCustomers; pipeline owns rep field"
"customers-churn","now","wired","getCustomers","Give me a list of customers sorted by ARR descending.","Explicit sort request"
"customers-churn","now","wired","getMetric","What's the logo retention rate this year?","logo_retention metric directly"
"customers-churn","now","wired","getCustomers","How many customers churned vs how many we added?","Adds and churns both from register"
"customers-churn","decline","na","decline","What's the credit score / financial health of our customers' parent companies?","External-market/PII data beyond the demo seed"
"customers-churn","decline","na","decline","Who owns equity in our largest customer?","Cap table is out of scope (Carta's job)"
"customers-churn","decline","na","decline","What's the industry-average SaaS churn rate for comparison?","Non-Bearing external-market data"
"customers-churn","decline","na","decline","What will churn look like in 2028?","Beyond the Dec 2026 seed horizon"
"customers-churn","gap","stub","setDriver","Model what happens to ARR if churn doubles next year.","Scenario engine is a stub; no setDriver wired"
"customers-churn","gap","stub","setDriver","If we lost our top 3 customers, what happens to ARR?","What-if churn scenario; engine not built"
"customers-churn","ambiguous","wired","getCustomer","Show me each customer's ARR trend over the last year.","getCustomer per-account timeline vs getCustomers single-period list"
"customers-churn","now","wired","getMetric","What's the expansion ARR from the i-12 cohort specifically?","Cohort expansion underlies NRR; getMetric nrr basis"
"customers-churn","now","wired","getCustomers","Tell me about our churned accounts in detail.","Churned customers list with detail"
"customers-churn","now","wired","getCustomers","Has any big customer reduced their contract value?","Contraction flag, sorted by ARR impact"
"customers-churn","ambiguous","wired","getMetric","What's our gross dollar retention this year?","grr metric vs Renewals getGrr (not wired)"
"customers-churn","now","wired","getCustomers","List customers acquired in the last 6 months and their ARR.","Date-filtered customer list with ARR"
"customers-churn","ambiguous","wired","getMetric","How does our retention compare to last year?","retention metric over periods vs churned-logo count"
"customers-churn","ambiguous","wired","getCustomers","What's the total contract value of our customer base?","customer-level ARR/TCV vs getContracts contract values"
"customers-churn","now","wired","getCustomers","Which customers contribute more than $500K in ARR?","Threshold filter on per-customer ARR"
"customers-churn","now","wired","getCustomers","Did we have a churn spike at any point this year?","Seed has a churn-spike event; surface from register"
"customers-churn","decline","na","decline","What's the personal email of the contact at Northwind Cloud?","PII beyond the demo; not stored"
"customers-churn","gap","none","getCustomer","How many seats does our largest customer have?","Seat/usage detail not modeled in customer records"
"customers-churn","now","wired","getCustomers","What's our net new ARR after churn and expansion this year?","New + expansion − contraction − churn from register"
"pipeline","gap","stub","getPipeline","What's our total open pipeline right now?","needs getPipeline + Pipeline register"
"pipeline","gap","stub","getPipeline","How much pipeline do we have by stage?","needs getPipeline by-stage aggregation"
"pipeline","gap","stub","getPipelineCoverage","Show me pipeline coverage against the Q3 number.","needs getPipelineCoverage query"
"pipeline","gap","stub","getPipelineCoverage","Whats our coverage ratio heading into next quarter?","needs getPipelineCoverage query"
"pipeline","gap","stub","getPipeline","Which rep has the most pipeline?","needs getPipeline by-rep aggregation"
"pipeline","gap","stub","getPipeline","Break down open opportunities by owner.","needs getPipeline by-rep aggregation"
"pipeline","gap","stub","getPipeline","How many deals are in the pipeline?","needs getPipeline + register"
"pipeline","gap","stub","getPipeline","What's the average deal size in our pipeline?","needs getPipeline aggregation"
"pipeline","gap","stub","getPipeline","Tell me about our biggest open deal.","needs getPipeline + deal-level drill"
"pipeline","gap","stub","getPipeline","What's the largest opportunity in late stage right now?","needs getPipeline by-stage + deal drill"
"pipeline","gap","stub","getPipeline","How much is in our committed/best-case forecast for this quarter?","needs getPipeline forecast-category weighting"
"pipeline","gap","stub","getPipeline","What's the weighted pipeline value?","needs getPipeline probability weighting"
"pipeline","gap","stub","getPipeline","How many deals are stuck in negotiation?","needs getPipeline by-stage"
"pipeline","gap","stub","getPipeline","Show me everything in proposal stage.","needs getPipeline by-stage list"
"pipeline","gap","stub","getPipeline","What's our pipeline value vs last quarter?","needs getPipeline with period comparison"
"pipeline","gap","stub","getPipeline","Is pipeline up or down year over year?","needs getPipeline YoY (pipeline is point-in-time, not a seeded time series)"
"pipeline","gap","stub","getPipeline","What's our win rate on closed deals this year?","needs getPipeline + closed-won/lost outcomes"
"pipeline","gap","stub","getPipeline","How many opportunities did we lose in Q2 and why?","needs getPipeline closed-lost + reason field"
"pipeline","gap","stub","getPipeline","What's the average sales cycle length?","needs getPipeline with created/closed dates"
"pipeline","gap","stub","getPipeline","How much pipeline is expected to close in June?","needs getPipeline by-close-date"
"pipeline","gap","stub","getPipeline","What deals are slipping out of the quarter?","needs getPipeline close-date change tracking"
"pipeline","gap","stub","getPipeline","Give me the pipeline for the subscription stream only.","needs getPipeline by-stream filter"
"pipeline","gap","stub","getPipeline","How much services pipeline do we have?","needs getPipeline by-stream filter"
"pipeline","gap","stub","getPipeline","What's the new-logo vs expansion split in the pipeline?","needs getPipeline new/expansion classification"
"pipeline","gap","stub","getPipeline","Which deals are most likely to close this month?","needs getPipeline probability + close-date"
"pipeline","gap","stub","getPipeline","What's in the pipeline for the enterprise segment?","needs getPipeline by-segment filter"
"pipeline","gap","stub","getPipelineCoverage","How does pipeline coverage compare across reps?","needs getPipelineCoverage by-rep"
"pipeline","gap","stub","getPipeline","How much pipeline did we add this month?","needs getPipeline created-in-period"
"pipeline","gap","stub","getPipeline","What's our pipeline-to-close conversion by stage?","needs getPipeline stage-conversion analytics"
"pipeline","gap","stub","getPipeline","Show me all open deals over $100K.","needs getPipeline value filter"
"pipeline","gap","stub","getPipeline","Who's the rep on the Helix AI opportunity and what stage is it in?","needs getPipeline + deal-level drill"
"pipeline","gap","stub","getPipeline","What's the expected ARR from deals closing this quarter?","needs getPipeline ARR projection"
"pipeline","gap","stub","getPipelineCoverage","How much of next quarter's revenue is already in pipeline vs needs to be created?","needs getPipelineCoverage + plan target"
"pipeline","gap","stub","getPipeline","What's the oldest deal in our pipeline?","needs getPipeline age/aging"
"pipeline","gap","stub","getPipeline","How many opps moved stages this week?","needs getPipeline stage-change history"
"pipeline","gap","stub","getPipeline","What's our pipeline by close date for the rest of FY26?","needs getPipeline by-close-date timeline"
"pipeline","gap","stub","getPipeline","Which accounts have open expansion opportunities?","needs getPipeline expansion filter + customer link"
"pipeline","gap","stub","getPipeline","What stage is the Northwind Cloud deal in?","needs getPipeline + deal-level drill"
"pipeline","gap","stub","getPipelineCoverage","Do we have enough pipeline to hit plan?","needs getPipelineCoverage + plan target"
"pipeline","gap","stub","getPipeline","What's the total value of deals forecast to commit?","needs getPipeline forecast-category"
"pipeline","gap","stub","getPipeline","How many net-new logos are in the pipeline?","needs getPipeline new-logo classification"
"pipeline","gap","stub","getPipeline","Break pipeline down by industry.","needs getPipeline by-industry attribute"
"pipeline","now","wired","getBookingsHistory","What's our bookings trend year over year?","getBookingsHistory handles YoY/TTM bookings"
"pipeline","now","wired","getBookingsHistory","How did bookings this quarter compare to last year?","getBookingsHistory YoY bookings"
"pipeline","now","wired","getContracts","Show me the deals we've already closed and signed this year.","closed-won lives in getContracts register"
"pipeline","ambiguous","wired","getBookingsHistory","How much did we book last month from the pipeline?","may hit getContracts single-month bookings view instead of getBookingsHistory"
"pipeline","ambiguous","wired","getContracts","What closed last quarter?","may misroute to getPnL/getMonthlyPnL (closed period) instead of pipeline/contracts"
